group,link,title,element1,element2,desc,label,role,cover
info,,,,,Updated: October.2025,time,,
info,,,,,"Currently, I design full-stack news visualizations at South China Morning Post Graphics in Hong Kong. ",background,,info/hkvictoria.png
info,,,,,My journey has also included leading creative production at the Global-Comm Lab of China News Service and working as a graphics reporter and product manager at Xinhua Media Creatives. ,background,,info/beijingtns.png
info,,,,,"Each role taught me how to adapt, innovate, and collaborate across disciplines and cultures.",background,,
info,,,,,With an industrial design ,skill,,info/tjuniv.png
info,,,,,"and information design background, ",skill,,info/koreauniv.png
info,,,,,"I thrive at the intersection of creativity and technology. I'm skilled in Adobe,Blender, Tableau, and Figma, ",skill,,
info,,,,,"building and interactive experiences with d3.js, GSAP, and three.js. I also embrace AIGC creativity, exploring new ways to co-create with technology. ",skill,,info/nanyangtech.png
info,,,,,"With a Ph.D. in Communication, my work is grounded in research and reflection—studying how visual narratives inform, persuade, and resonate. ",researchBk,,info/um.png
info,,,,,"I also care deeply about teaching, mentoring the next generation of data storytellers to think critically, design boldly, and experiment fearlessly.",researchBk,,
stories,https://multimedia.scmp.com/infographics/news/hong-kong/article/3326461/,When a typhoon hits Hong Kong,,,,"3D,scrollytelling,multimedia,science,culture","Developer,planner,3Dmodeler",img/tclife.gif
stories,https://multimedia.scmp.com/infographics/news/world/article/3294195/trump_orbit/,Power players: Trump’s team and views on China,,,,"interactive,scrollytelling,politics",Developer,img/tpobt.gif
stories,https://multimedia.scmp.com/infographics/sport/article/3271702/paris-2024-openning-ceremony/index.html,"A different opening, the River Seine scenario",,,,"scrollytelling,culture",Developer,img/opening.gif
stories,https://multimedia.scmp.com/infographics/news/china/article/3300868/china_us_powers/index.html?1,The China-US face-off,,,,"interactive,scrollytelling,politics",Developer,img/cufo.gif
stories,https://multimedia.scmp.com/infographics/news/world/article/3320825/hiroshima_nagasaki/index.html,"Hiroshima and Nagasaki, visualising the human toll from the world’s first nuclear attacks",,,,"scrollytelling,politics",Developer,img/atmbmb.gif
stories,https://multimedia.scmp.com/infographics/news/hong-kong/article/3275641/panda-tracker/,Panda twins tracker,,,,"interactive,society",Developer,img/panda.gif
stories,https://multimedia.scmp.com/infographics/news/world/article/3310236/habemus-papa/index.html,Chosen one: the rise of Pope Leo XIV,,,,"scrollytelling,culture",Developer,img/pope.gif
stories,,Weather vis collection,"<iframe title=""Frequency of typhoon warnings in Hong Kong"" aria-label=""Scatter Plot"" id=""datawrapper-chart-99hzt"" src=""https://datawrapper.dwcdn.net/99hzt/4/"" scrolling=""no"" frameborder=""0"" style=""width: 0; min-width: 100% !important; border: none;"" height=""832"" data-external=""1""></iframe><script type=""text/javascript"">!function(){""use strict"";window.addEventListener(""message"",(function(a){if(void 0!==a.data[""datawrapper-height""]){var e=document.querySelectorAll(""iframe"");for(var t in a.data[""datawrapper-height""])for(var r=0;r<e.length;r++)if(e[r].contentWindow===a.source){var i=a.data[""datawrapper-height""][t]+""px"";e[r].style.height=i}}}))}();
</script>
<br/>The visualization shows the Frequency of typhoon warnings in Hong Kong. The vis block is used in SCMP article: <a href=""https://www.scmp.com/news/hong-kong/health-environment/article/3286318/typhoon-toraji-hong-kong-issue-t3-240pm-3-other-storms-exist-same-time"" target=""_blank"">Tropical Storm Toraji: Hong Kong issues T8 typhoon warning signal</a>
                          ","<iframe width=""100%"" height=""800"" src=""https://multimedia.scmp.com/embeds/2025/china/beijing_flood/"" scrolling=""no"" frameborder=""0"">/iframe>
<br/>Lorem ipsum dolor sit amet",,"interactive,science",Developer,img/tytrk.gif
stories,,Grumpy cat goes wild,<img src='works/plct.jpg' />,,,"infographics,science","Designer,writer",img/plsc.png
stories,,Living with Mum: How is the first year of a panda,<img src='works/pandamlther.jpg' />,,,"infographics,science","Designer,writer",img/pandamother.png
stories,,How Al learns to create and generate,<img src='works/genairobot.jpg' /> ,,,"infographics,science","Designer,writer",img/genai.png
stories,,Please mind the paws on Light Rail,<img src='works/pet_public.jpg' /> ,,,"infographics,society","Designer,writer,planner",img/petonboard.jpg
stories,,,"<iframe width=""100%"" height=""560"" src=""https://multimedia.scmp.com/embeds/2024/sport/euro-cup-score/"" scrolling=""no"" frameborder=""0""></iframe>
<br/>Used in SCMP article: <a href=""https://www.scmp.com/sport/football/article/3265197/when-euro-2024-where-can-i-watch-it-who-can-stop-france-england-all-you-need-know-about-summer"">Euro 2024 fixtures, results, tables, how to watch, who will win and all you need to know</a>","<iframe width=""100%"" height=""590"" src=""https://multimedia.scmp.com/embeds/2024/sport/paris-olympics-medal-tally/"" scrolling=""no"" frameborder=""0""></iframe>",,"interactive,sports",Developer,img/euro.gif
stories,,,"<iframe width=""100%"" height=""420"" src=""https://multimedia.scmp.com/embeds/2024/economy/Dollar-Yuan-Exchange-Rate/index.html?1"" scrolling=""no"" frameborder=""0"">/iframe>
<br/>Used in SCMP article: <a href=""https://www.scmp.com/economy/economic-indicators/article/3276877/chinas-yuan-continue-gain-against-us-dollar-outlook-hinges-fed-analysts"">China’s yuan to continue to gain against US dollar, but outlook hinges on Fed: analysts</a>","<iframe width=""100%"" height=""600"" src=""https://multimedia.scmp.com/embeds/2024/economy/bond_yield/"" scrolling=""no"" frameborder=""0""></iframe>
<br/>Used in SCMP article: <a href=""https://www.scmp.com/opinion/china-opinion/article/3289447/why-plunge-chinas-bond-yields-not-bad-news"" target=""_blank"">Macroscope | Why the plunge in China’s bond yields is not bad news</a>
",,"interactive,economy",Developer,img/dyex.gif
stories,,,"Used in SCMP US election live blog: <a href = 'https://www.scmp.com/news/us/us-elections/article/3285364/us-presidential-election-2024-electoral-college-results-live' >US presidential election 2024: Electoral College results live</a>
<iframe width=""100%"" height=""720"" src=""https://multimedia.scmp.com/embeds/2024/world/us-election-map-2024/index_all.html"" scrolling=""no"" frameborder=""0""></iframe>","<iframe width=""100%"" height=""720"" src=""https://multimedia.scmp.com/embeds/2024/world/us-election-map-2024/index_choro.html"" scrolling=""no"" frameborder=""0"">/iframe>",,"interactive,politics",Developer,img/usel.gif
stories,https://multimedia.scmp.com/infographics/news/hong-kong/article/3310994/pet_on_mtr/index.html,Paws on the move: pet-friendly transport in Hong Kong,,,,"scrollytelling,society","writer,developer",img/petMTR.gif
stories,https://www.chinanews.com.cn/gn/2023/11-20/10114994.shtml,新疆，何以“亚心”,,,,"3D,multimedia,politics","planner,writer,designer",img/yx.gif
stories,https://www.chinanews.com.cn/cul/2023/10-17/10095597.shtml,丝路千年大数据揭秘茶咖融合的前世今生,,,,"multimedia,politics,culture","planner,writer,designer",img/ckrh.gif
stories,https://www.chinanews.com.cn/gn/2023/09-23/10082818.shtml,万首诗词大数据告诉你为何“最忆是杭州”,,,,"multimedia,politics,culture","planner,writer,designer",img/hzsc.gif
stories,https://mp.weixin.qq.com/s?__biz=MzIyNDA2NTI4Mg==&mid=2655499162&idx=2&sn=9b16fb3e0b07484200b55f5a93fdcad9&chksm=f27ed2010c9403868125e682ce93a01f3c69e0669b53af1e25e40b5f1185fb08eafc0fe74b78&mpshare=1&scene=1&srcid=0307eovSryt4ad9qf0ratRBn&sharer_shareinfo=cb44a211439c7c2da088dbb0bf85c88c&sharer_shareinfo_first=5ffdd0a16d33432c10f3dddb483972cb#rd,北上广深的公共体育设施资源知多少？,,,,"infographics,society","planner,writer,designer",img/tyss22.png
stories,,,"Visualization of the wildcats' body data, global distribution, and data of relevant publications. The graphics was inserted as the first figure in the following publication: Xie, Bing & Gong, Yinan & Fu, Yanwen & Feng, Limin & Yang, Haitao. (2023). Does the territorial behaviour of the Amur tiger affect the accuracy of occupancy estimation?. 10.1101/2023.01.16.524338.
<br/><img src='works/wildcats.png' />",,,"infographics,science","Designer,illustrator",img/widecats.png
stories,, ,"The relationship of Essential Biodiversity Variables (EBVs) names to Aichi Biodiversity Targets and the United Nations Sustainable Development Goals (SDGs)
<br/><img src='works/ecoconn.png' /> ","<img src='works/ecolit.png' /> 
<br/>任淯, & Sl, Tao & Ty, Hu & Ht, Yang & Hc, Guan & Yj, Su & Mx, Chen & Hw, Wan & Ren, Yu & Tao, Shengli & Hu, Tianyu & Yang, Haitao & Guan, Hongcan & Su, Yanjun & Cheng, Kai & Chen, Mengxi & Wan, Huawei & Guo, Qinghua. (2023). 中国生物多样性核心监测指标遥感产品体系构建 与思考 The outlook and system construction for monitoring Essential Biodiversity Variables based on remote sensing: The case of China. Biodiversity Science. 22530. 10.17520/biods.2022530. ",,"infographics,science",Designer,img/ecocnn.png
stories,http://www.news.cn/datanews/20211015/C99905849A1000012A8E18C0199B1681/c.html,家宴，人间至味是团圆,,,,"interactive,culture","planner,writer,designer",img/cjjy.gif
stories,http://www.news.cn/datanews/20211015/C999058552E00001AF4E9CEBA7207460/c.html,宋词缱绻，何处画人间,,,,"interactive,culture","planner,writer,designer",img/sciqqinfo.png
stories,http://www.xinhuanet.com/datanews/20211015/C999058552A00001BA72DEF01090BE50/c.html,真正的“侏罗纪世界”，在中国,,,,"infographics,science","planner,writer,designer",img/zljsjzh.png
stories,http://www.news.cn/datanews/20211015/C9990585530000013946104011B05E70/c.html,从珠江口到大屿山：双甲子承诺如何炼成,,,,"infographics,science","planner,writer,designer",img/hzmb.png
stories,,China Story series: China Metro System,<img src='works/cnstory4.png' /> ,,,"infographics,science,economy","Writer,designer",img/cnstory4.png
stories,,China Story series: China Cross-Border Energy Pathway,<img src='works/cnstory2.png' /> ,,,"infographics,science,economy","Writer,designer",img/cnstory2.png
stories,,China Story series: China 5G,<img src='works/cnstory3.png' /> ,,,"infographics,science","Writer,designer",img/5gtech.png
stories,,China Story series: C919,<img src='works/cnstory1.png' /> ,,,"infographics,science,3D","Writer,designer",img/cnstory.png
stories,https://fms.news.cn/swf/2018_sjxw/quansongci/index.html#/,宋词缱绻，何处画人间,,,,"infographics,culture","planner,writer,designer,developer(second)",img/sciqqinter.gif
stories,,马航MH370：等你的1728天,"A creative infographic summarizing the missing plane MH370, including the timeline, locations, and plane structure.
<br/><img src='works/MH370.jpg' /> ",,,infographics,Designer,img/MH370.png
stories,,音曲繁美：流行音乐的百年分化与融合,"Originally an interactive page visualizing how ten main popular music genres have been evovling over the last 100 years. The page was withdrawn due to Xinhua's publication policy.
<br/><img src='works/lxyy.png' /> ",,,"interactive,culture","planner,writer,designer,developer(second)",img/lxyy.png
stories,,隐藏的运动场：8小时外健身休闲，如何说走就走,"Originally a static page visulizing the distribution of the public recreation places in Beijing. The project was withdrawn due to Xinhua's publication policy.
<br/><img src='works/tyss17.jpg' /> ",,,"interactive,society","planner,writer,designer,developer(second)",img/tyss17.png
stories,,原创综艺的春天还有多远,"The project is originally an interactive page exploring the features of China's reality shows and why most of them are not original. The project was withdrawn due to Xinhua's publication policy.
<br/><img src='works/yczy.png' /> ",,,"interactive,society",Designer,img/yczy.png
stories,,世界大港建成记：洋山港的建设历程,"A creative infographic illustrating the construction of the Yangshan Port.
<br/><img src='works/ysg.jpg' /> ",,,"infographics,science",Illustrator,img/ysg.png
stories,,Chart collector,<img src='works/dummy_mp.png' /> ,<img src='works/dummy_mp.png' /> ,,"interactive,science,sports","planner,writer,designer",img/olymbd.png
stories,,Model collector,"<img src='works/haiou.png' /> 
<br/>University souvenir watches","<img src='works/robot.png' /> 
<br/>Tower-climbing robot for the wind turbine tower maintenance",,"infographics,science,3D",3Dmodeler,img/robt.jpg
articles,https://www.phei.com.cn/module/goods/wssd_content.jsp?bookid=63275,"Bremer, N., & Wu, S. (2021). Data Sketches: A journey of imagination, exploration, and beautiful data visualizations.",,,Lorem ipsum dolor sit amet,,,articles/ds.png
articles,https://scholarship.miami.edu/esploro/outputs/doctoral/Decisions-in-News-Visualization--How/991031788917602976,Decisions in News Visualization: How News Visualization Teams Employ a Shared Mental Model,,,"This study aims to investigate the shared mindsets a team of professionals relies on to make collaborative production decisions, i.e., the shared mental model guiding professionals' news visualization production. A shared mental model is the shared cognitive structure held by all individual members of a team that helps them make sense of their tasks. ",,,articles/smm.png
articles,https://www.researchgate.net/publication/371504265_Analyzing_Dorian_Twitter_Data_to_Understand_How_Hurricane_Risk_Assessments_Change_as_Threats_Unfold,Analyzing Dorian Twitter Data to Understand How Hurricane Risk Assessments Change as Threats Unfold,,,"The results showed that professional accounts are more likely to post original content than share, among which most of the organizational accounts (including forecasters, emergency managements, and news outlets) post in regular intervals with a fixed message format and a neutral opinion while professional individual accounts (e.g. meteorologist, broadcasters) post with no  observable temporal regulation,  variable forms, and  sentiments. However,  the forecaster accounts  are less engaged than  the mediator accounts  (i.e. news outlets and professional individual account holders). The study also revealed that under the hurricane risk context, those willing to share information rely more on post timing and expertise of post creators, rather than message type and sentiment.",,,articles/dorian.png
articles,https://www.researchgate.net/publication/365501317_Design_guidelines_for_hurricane_risk_forecast_to_non-expert_users,Design guidelines for hurricane risk forecast to non-expert users,,,"Hurricane forecast graphics, such as the cone of uncertainty and the hurricane threat impacts graphics, are provided to assist the general public in assessing their risk and in making protective action decisions for an approaching storm. Many researchers have demonstrated that hurricane forecast graphics are often misinterpreted by the general public. Few studies, however, have investigated the impact of design elements of these graphics on interpretations of hurricane risk communication for non-expert users. This study provides design guidelines for improving hurricane risks forecast products based on a literature review.",,,articles/hurri.png
articles,https://www.researchgate.net/publication/356168022_Design_Guidelines_for_Immersive_Dashboards,Design Guidelines for Immersive Dashboards,,,"Immersive dashboards facilitate the presentation of large-scale complex data while offering natural interaction and real-time interactivity supporting immediate use. Few studies, however, have investigated the use of immersive dashboards to improve the visualization and analysis of abstract data. This study provides a systematic review of the literature on designing immersive dashboards for abstract data visualization and analytics. Twenty publications met the inclusion criteria. This review identifies guidelines for improving immersive dashboard design.",,,articles/immersive.jpg
articles,https://docs.google.com/document/d/1LScgWtZt8I9oVTjmpgtJWQ8n9ieFTTr2fkpTQR19-SU/edit?usp=sharing,Design suggestions of the hurricane threat impact graphics (summary of an investigation),,,Lorem ipsum dolor sit amet,,,articles/hit.png
articles,https://osf.io/preprints/osf/62swr,Unfolding the Decision-Making Dynamics of News Visualization Production in China,,,"A grounded analysis drawing on 15 in-depth interviews with professionals reveals the dynamics of source selection, interpretation, and presentation in news visualization production. It also shows that news visualization stories result from the debating and tradeoffs between the ""western norms"" and the organization's expectations, audiences' preferences, news commercialization, and macro environment in China.",,,articles/cndatanews.jpg
articles,https://kawan.kontinentalist.com/meet-the-community-catherine-ma-communications-phd-student-at-university-of-miami/,Data journalism in China (Interviewed by Kontinentalist),,,Lorem ipsum dolor sit amet,,,articles/katiinter.png
something,,Lorem ipsum dolor sit amet,something/flowers.png,,,,,
something,,Lorem ipsum dolor sit amet,something/garden.png,,,,,
something,,Lorem ipsum dolor sit amet,something/dx.mp4,,,,,
something,,Lorem ipsum dolor sit amet,something/night.png,,,,,
something,,Lorem ipsum dolor sit amet,something/product.png,,,,,
something,,Lorem ipsum dolor sit amet,something/yz.mp4,,,,,
something,,Lorem ipsum dolor sit amet,something/scene.png,,,,,
something,,Lorem ipsum dolor sit amet,something/window.png,,,,,
something,,Lorem ipsum dolor sit amet,something/always.mp4,,,,,
something,,Lorem ipsum dolor sit amet,something/biscbay.jpg,,,,,
something,,Lorem ipsum dolor sit amet,something/bmw.jpg,,,,,
something,,Lorem ipsum dolor sit amet,something/afm.mp4,,,,,
something,,Lorem ipsum dolor sit amet,something/cats.jpg,,,,,
something,,Lorem ipsum dolor sit amet,something/flw1.jpg,,,,,
something,,Lorem ipsum dolor sit amet,something/hy.mp4,,,,,
something,,Lorem ipsum dolor sit amet,something/flw2.jpg,,,,,
something,,Lorem ipsum dolor sit amet,something/ry.mp4,,,,,
something,,Lorem ipsum dolor sit amet,something/flw3.jpg,,,,,
something,,Lorem ipsum dolor sit amet,something/dnhb.mp4,,,,,
something,,Lorem ipsum dolor sit amet,something/lake.jpg,,,,,
something,,Lorem ipsum dolor sit amet,something/lindraw.jpg,,,,,
something,,Lorem ipsum dolor sit amet,something/wy.mp4,,,,,
something,,Lorem ipsum dolor sit amet,something/nms.jpg,,,,,
something,,Lorem ipsum dolor sit amet,something/xbn.mp4,,,,,
something,,Lorem ipsum dolor sit amet,something/park.jpg,,,,,
something,,Lorem ipsum dolor sit amet,something/pathway.jpg,,,,,
something,,Lorem ipsum dolor sit amet,something/redroadcenter.jpg,,,,,
something,,Lorem ipsum dolor sit amet,something/snydxhh.mp4,,,,,
something,,Lorem ipsum dolor sit amet,something/sdlr.jpg,,,,,
something,,Lorem ipsum dolor sit amet,something/tree.jpg,,,,,